{
  "schema_version": "1.0.0",
  "env_id": "HAIC_Exp",
  "sim_id": "exp_l2d",
  "timestamp": "2025-09-21T12:59:25.523083Z",
  "attributes": {
    "task": "classification"
  },
  "agents": {
    "AI": {
      "attributes": {},
      "model": "ai",
      "affordances": [
        "classify"
      ]
    },
    "H": {
      "attributes": {},
      "model": "human",
      "affordances": [
        "classify"
      ]
    }
  },
  "objects": {
    "O1": {
      "attributes": {
        "row": 1
      },
      "affordances": [
        "classify"
      ]
    },
    "O2": {
      "attributes": {
        "row": 2
      },
      "affordances": [
        "classify"
      ]
    },
    "O3": {
      "attributes": {
        "row": 3
      },
      "affordances": [
        "classify"
      ]
    },
    "O4": {
      "attributes": {
        "row": 4
      },
      "affordances": [
        "classify"
      ]
    },
    "O5": {
      "attributes": {
        "row": 5
      },
      "affordances": [
        "classify"
      ]
    },
    "O6": {
      "attributes": {
        "row": 6
      },
      "affordances": [
        "classify"
      ]
    },
    "O7": {
      "attributes": {
        "row": 7
      },
      "affordances": [
        "classify"
      ]
    },
    "O8": {
      "attributes": {
        "row": 8
      },
      "affordances": [
        "classify"
      ]
    },
    "O9": {
      "attributes": {
        "row": 9
      },
      "affordances": [
        "classify"
      ]
    },
    "O10": {
      "attributes": {
        "row": 10
      },
      "affordances": [
        "classify"
      ]
    }
  },
  "decisions": [
    {
      "schema_version": "1.0.0",
      "sim_id": "exp_l2d",
      "t": 2,
      "agent_id": "H",
      "action": "classify",
      "object_id": "O1",
      "effect": {
        "human_label": "positive",
        "deferred": true
      },
      "correct": true,
      "latency_ms": 800
    },
    {
      "schema_version": "1.0.0",
      "sim_id": "exp_l2d",
      "t": 4,
      "agent_id": "H",
      "action": "classify",
      "object_id": "O2",
      "effect": {
        "human_label": "positive",
        "deferred": true
      },
      "correct": true,
      "latency_ms": 800
    },
    {
      "schema_version": "1.0.0",
      "sim_id": "exp_l2d",
      "t": 6,
      "agent_id": "H",
      "action": "classify",
      "object_id": "O3",
      "effect": {
        "human_label": "positive",
        "deferred": true
      },
      "correct": true,
      "latency_ms": 800
    },
    {
      "schema_version": "1.0.0",
      "sim_id": "exp_l2d",
      "t": 8,
      "agent_id": "H",
      "action": "classify",
      "object_id": "O4",
      "effect": {
        "human_label": "positive",
        "deferred": true
      },
      "correct": true,
      "latency_ms": 800
    },
    {
      "schema_version": "1.0.0",
      "sim_id": "exp_l2d",
      "t": 10,
      "agent_id": "H",
      "action": "classify",
      "object_id": "O5",
      "effect": {
        "human_label": "positive",
        "deferred": true
      },
      "correct": true,
      "latency_ms": 800
    },
    {
      "schema_version": "1.0.0",
      "sim_id": "exp_l2d",
      "t": 12,
      "agent_id": "H",
      "action": "classify",
      "object_id": "O6",
      "effect": {
        "human_label": "positive",
        "deferred": true
      },
      "correct": true,
      "latency_ms": 800
    },
    {
      "schema_version": "1.0.0",
      "sim_id": "exp_l2d",
      "t": 14,
      "agent_id": "H",
      "action": "classify",
      "object_id": "O7",
      "effect": {
        "human_label": "positive",
        "deferred": true
      },
      "correct": true,
      "latency_ms": 800
    },
    {
      "schema_version": "1.0.0",
      "sim_id": "exp_l2d",
      "t": 16,
      "agent_id": "H",
      "action": "classify",
      "object_id": "O8",
      "effect": {
        "human_label": "positive",
        "deferred": true
      },
      "correct": true,
      "latency_ms": 800
    },
    {
      "schema_version": "1.0.0",
      "sim_id": "exp_l2d",
      "t": 18,
      "agent_id": "H",
      "action": "classify",
      "object_id": "O9",
      "effect": {
        "human_label": "positive",
        "deferred": true
      },
      "correct": true,
      "latency_ms": 800
    },
    {
      "schema_version": "1.0.0",
      "sim_id": "exp_l2d",
      "t": 20,
      "agent_id": "H",
      "action": "classify",
      "object_id": "O10",
      "effect": {
        "human_label": "positive",
        "deferred": true
      },
      "correct": true,
      "latency_ms": 800
    }
  ]
}